<?xml version="1.0" encoding="UTF-8" standalone="yes"?>
<Student xmlns:xsi="http://www.w3.org/2001/XMLSchema-instance" xsi:noNamespaceSchemaLocation="student.xsd">
    <vorname>Max</vorname>
    <nachname>Mustermann</nachname>
    <wohnort>
        <strasse>Musterstr</strasse>
        <hausnr>123a</hausnr>
        <plz>12345</plz>
        <stadt>Berlin</stadt>
    </wohnort>
    <matrikelnummer>545344</matrikelnummer>
    <studiengang>AI</studiengang>
    <fachsemester>1</fachsemester>
</Student>
